{
  "schemaVersion": 1,
  "id": "centrifuge",
  "name": "Centrifuge",
  "status": "active",
  "website": "https://centrifuge.io",
  "sources": [
    {
      "title": "Centrifuge official website",
      "url": "https://centrifuge.io",
      "accessedAt": "2026-10-01",
      "lastVerifiedAt": "2026-10-01",
      "reviewAfter": "2027-01-01",
      "confidence": "high"
    }
  ]
}
