{
  "schemaVersion": 1,
  "id": "trident-trust",
  "name": "Trident Trust",
  "status": "active",
  "website": "https://www.tridenttrust.com",
  "sources": [
    {
      "title": "Trident Trust official website",
      "url": "https://www.tridenttrust.com",
      "accessedAt": "2026-10-01",
      "lastVerifiedAt": "2026-10-01",
      "reviewAfter": "2027-01-01",
      "confidence": "high"
    }
  ]
}
